UC1:

mysql> create database PayRollService;
Query OK, 1 row affected (0.15 sec)

mysql> show databases;
+--------------------+
| Database           |
+--------------------+
| a                  |
| customer           |
| information_schema |
| kalyanidb          |
| marketing          |
| mysql              |
| onsql              |
| payrollservice     |
| performance_schema |
| student            |
| sys                |
| testdb             |
| world              |
| z                  |
+--------------------+
14 rows in set (0.00 sec)

mysql> use PayRollService;
Database changed

UC2:

mysql> use PayRoll_Service;
Database changed

mysql> create table employeePayroll
-> (id     INT unsigned NOT NULL AUTO_INCREMENT,name varchar(20) not null, salary double not null,start date not null,PRIMARY KEY(id));
Query OK, 0 rows affected (0.66 sec)

mysql> describe employeePayroll;
+--------+--------------+------+-----+---------+----------------+
| Field  | Type         | Null | Key | Default | Extra          |
+--------+--------------+------+-----+---------+----------------+
| id     | int unsigned | NO   | PRI | NULL    | auto_increment |
| name   | varchar(20)  | NO   |     | NULL    |                |
| salary | double       | NO   |     | NULL    |                |
| start  | date         | NO   |     | NULL    |                |
+--------+--------------+------+-----+---------+----------------+
4 rows in set (0.01 sec)

UC3:

mysql>  insert into employeePayroll(id,name,salary,start) values (1,"kalyani",40000.00,"2022-05-22"),(2,"Ayansh",45000.00,"2022-05-22"),(3,"jawahar",55000.00,"2022-05-22");
Query OK, 3 rows affected (0.15 sec)
Records: 3  Duplicates: 0  Warnings: 0

mysql> select * from employeePayroll;
+----+---------+--------+------------+
| id | name    | salary | start      |
+----+---------+--------+------------+
|  1 | kalyani |  40000 | 2022-05-22 |
|  2 | Ayansh  |  45000 | 2022-05-22 |
|  3 | jawahar |  55000 | 2022-05-22 |
+----+---------+--------+------------+
3 rows in set (0.00 sec)

mysql> select * from employeePayroll;
+----+---------+--------+------------+
| id | name    | salary | start      |
+----+---------+--------+------------+
|  1 | kalyani |  40000 | 2022-05-22 |
|  2 | Ayansh  |  45000 | 2022-05-22 |
|  3 | jawahar |  55000 | 2022-05-22 |r
+----+---------+--------+------------+
3 rows in set (0.00 sec)

UC5:

mysql> select salary from employeePayroll where name ='kalyani';
+--------+
| salary |
+--------+
|  40000 |
+--------+
1 row in set (0.00 sec)

mysql> delete from employeePayroll where name='kalyani';
Query OK, 1 row affected (0.12 sec)

mysql> insert into employeePayroll(id,name,salary,start) values(1,"kalyani",40000.00,"2020-02-29");
Query OK, 1 row affected (0.10 sec)

mysql> select * from employeePayroll;
+----+---------+--------+------------+
| id | name    | salary | start      |
+----+---------+--------+------------+
|  1 | kalyani |  40000 | 2020-02-29 |
|  2 | Ayansh  |  45000 | 2022-05-22 |
|  3 | jawahar |  55000 | 2022-05-22 |
|  4 | kittu   |  22000 | 2022-05-22 |
+----+---------+--------+------------+
4 rows in set (0.00 sec)

mysql> select * from employeePayroll where start between cast("2020-02-29" as date) and date(now());
+----+---------+--------+------------+
| id | name    | salary | start      |
+----+---------+--------+------------+
|  1 | kalyani |  40000 | 2020-02-29 |
|  2 | Ayansh  |  45000 | 2022-05-22 |
|  3 | jawahar |  55000 | 2022-05-22 |
|  4 | kittu   |  22000 | 2022-05-22 |
+----+---------+--------+------------+
4 rows in set (0.08 sec)


UC6:

mysql> alter table employeePayroll ADD gender CHAR(1) AFTER name;
Query OK, 0 rows affected (0.80 sec)
Records: 0  Duplicates: 0  Warnings: 0

mysql> select * from employeePayroll;
+----+---------+--------+--------+------------+
| id | name    | gender | salary | start      |
+----+---------+--------+--------+------------+
|  1 | kalyani | NULL   |  40000 | 2020-02-29 |
|  2 | Ayansh  | NULL   |  45000 | 2022-05-22 |
|  3 | jawahar | NULL   |  55000 | 2022-05-22 |
|  4 | kittu   | NULL   |  22000 | 2022-05-22 |
+----+---------+--------+--------+------------+
4 rows in set (0.00 sec)

mysql> alter table employeePayroll drop gender;
Query OK, 0 rows affected (0.29 sec)
Records: 0  Duplicates: 0  Warnings: 0

mysql> select * from employeePayroll;
+----+---------+--------+------------+
| id | name    | salary | start      |
+----+---------+--------+------------+
|  1 | kalyani |  40000 | 2020-02-29 |
|  2 | Ayansh  |  45000 | 2022-05-22 |
|  3 | jawahar |  55000 | 2022-05-22 |
|  4 | kittu   |  22000 | 2022-05-22 |
+----+---------+--------+------------+
4 rows in set (0.00 sec)

mysql>drop database payroll_service;

create table Employee_Payrol (employee_phone int(10) not null, employee_Address varchar(100),employee_Department varchar(50));
Query OK, 0 rows affected, 1 warning (0.56 sec)

describe Employee_Payrol;
+---------------------+--------------+------+-----+---------+-------+
| Field               | Type         | Null | Key | Default | Extra |
+---------------------+--------------+------+-----+---------+-------+
| employee_phone      | int          | NO   |     | NULL    |       |
| employee_Address    | varchar(100) | YES  |     | NULL    |       |
| employee_Department | varchar(50)  | YES  |     | NULL    |       |
+---------------------+--------------+------+-----+---------+-------+
3 rows in set (0.01 sec)

ALTER TABLE Employee_payrol11 ADD deductions DOUBLE NOT NULL AFTER basic_pay,ADD taxable_pay DOUBLE NOT NULL AFTER deductions,ADD income_tax DOUBLE NOT NULL AFTER taxable_pay, ADD net_pay DOUBLE NOT NULL AFTER income_tax;
Query OK, 0 rows affected (1.48 sec)
Records: 0  Duplicates: 0  Warnings: 0

mysql> describe Employee_payrol11;
+--------------+--------------+------+-----+---------+-------+
| Field        | Type         | Null | Key | Default | Extra |
+--------------+--------------+------+-----+---------+-------+
| id           | int          | NO   | PRI | NULL    |       |
| name         | varchar(30)  | YES  |     | NULL    |       |
| phone_Number | varchar(10)  | YES  |     | NULL    |       |
| Department   | varchar(50)  | YES  |     | NULL    |       |
| gender       | char(1)      | YES  |     | NULL    |       |
| basic_pay    | float        | YES  |     | NULL    |       |
| deductions   | double       | NO   |     | NULL    |       |
| taxable_pay  | double       | NO   |     | NULL    |       |
| income_tax   | double       | NO   |     | NULL    |       |
| net_pay      | double       | NO   |     | NULL    |       |
| deduction    | float        | YES  |     | NULL    |       |
| TaxablePay   | float        | YES  |     | NULL    |       |
| tax          | float        | YES  |     | NULL    |       |
| Netpay       | float        | YES  |     | NULL    |       |
| StartDate    | date         | YES  |     | NULL    |       |
| city         | varchar(100) | YES  |     | NULL    |       |
| country      | varchar(200) | YES  |     | NULL    |       |
+--------------+--------------+------+-----+---------+--
UC9

select * from  Employee_PayRol11;
+----+---------+--------------+------------+--------+-----------+-----------+------------+------+--------+------------+------+---------+
| id | name    | phone_Number | Department | gender | basic_pay | deduction | TaxablePay | tax  | Netpay | StartDate  | city | country |
+----+---------+--------------+------------+--------+-----------+-----------+------------+------+--------+------------+------+---------+
|  1 | kalyani | 9563214563   | IT         | F      |     30000 |      2000 |       1000 |  500 |   1000 | 2018-05-03 | pune | mumbai  |
+----+---------+--------------+------------+--------+-----------+-----------+------------+------+--------+------------+------+---------+
1 row in set (0.00 sec)
